{
  "$schema": "https://json-schema.org/draft/2020-12/schema",
  "$id": "https://pact.io/janus/plan/v1/corpus-case.schema.json",
  "title": "CorpusCase",
  "description": "The 'case.json' manifest of one golden-corpus case (spec.md §6). The plan and executed-plan text snapshots sit beside it as plan.txt and executed.txt; this document holds the halves that are assertions rather than snapshots.",
  "type": "object",
  "required": ["description", "input", "values", "result"],
  "properties": {
    "description": {
      "type": "string",
      "minLength": 1,
      "description": "What this case is evidence for, in one line."
    },
    "input": { "$ref": "#/$defs/Input" },
    "values": {
      "type": "object",
      "description": "The captured values the plan executes against, keyed by the paths a resolver would supply (spec.md §2.4). Offline: no transport runs."
    },
    "encoded": {
      "type": "object",
      "description": "The representation of a value in 'values' that is not its natural JSON form, by the same path (spec.md §6.1, engine-protocol spec §2.5). 'base64' means the value is the base64 of an octet sequence: a body no content component claims (ADR 0036). A path with no entry is JSON.",
      "additionalProperties": {
        "type": "string",
        "x-known-values": ["base64"]
      }
    },
    "result": { "$ref": "#/$defs/ExpectedResult" },
    "also-compiled-from": {
      "$ref": "#/$defs/Input",
      "description": "A second input that MUST reach the same verdicts as 'input' — the two-path agreement check of spec.md §4.4. Its plan may differ; its result may not."
    }
  },
  "$defs": {
    "Input": {
      "title": "Input",
      "description": "What is compiled. Open vocabulary of kinds so later designs can add their own.",
      "type": "object",
      "required": ["kind"],
      "properties": {
        "kind": {
          "type": "string",
          "x-known-values": ["spec", "pact-interaction"]
        },
        "spec": {
          "type": "object",
          "description": "For kind 'spec': the interaction specification (designs 2.5, 3.2)."
        },
        "pact": {
          "type": "object",
          "description": "For kind 'pact-interaction': the pact document (any supported version)."
        },
        "index": {
          "type": "integer",
          "minimum": 0,
          "description": "For kind 'pact-interaction': which interaction, by its position among the pact's interactions (a v3 message pact's messages). An HTTP interaction compiles to its request and response; a message to the produced message it is compared with, rooted at a 'message' part (staged plan S1.7)."
        },
        "variant": {
          "type": "string",
          "description": "The variant id to compile under (design 2.3). Absent compiles the shape unpinned."
        }
      }
    },
    "ExpectedResult": {
      "title": "ExpectedResult",
      "description": "The assertion half of a case: a diff here is a behaviour change, never an acceptable optimisation (spec.md §6.2).",
      "type": "object",
      "required": ["status"],
      "properties": {
        "status": {
          "type": "string",
          "description": "'matched' and 'mismatched' are verdicts of executing the plan. 'invalid' says the input is refused before there is a plan: the case then carries 'problems' and has no plan.txt or executed.txt (spec.md §6.1).",
          "x-known-values": ["matched", "mismatched", "invalid"]
        },
        "mismatches": {
          "type": "array",
          "description": "Every expected mismatch, in the plan's result form. A case that expects a mismatch and gets a different one has failed.",
          "items": { "$ref": "#/$defs/Mismatch" }
        },
        "problems": {
          "type": "array",
          "description": "For status 'invalid': every problem the engine must report when it refuses the input, in order. A case that expects a refusal and gets a plan, or different problems, has failed.",
          "items": { "$ref": "#/$defs/Problem" }
        }
      }
    },
    "Problem": {
      "title": "Problem",
      "description": "One reason an input is refused, as the engine reports it in an interaction-invalid error's details.",
      "type": "object",
      "required": ["pointer", "message"],
      "properties": {
        "pointer": {
          "type": "string",
          "description": "An RFC 6901 pointer into the input, at the node that is wrong."
        },
        "message": {
          "type": "string",
          "description": "Words the engine's message must contain. Not the whole message, so that rewording one does not fail a case that is about which input is refused and where."
        }
      }
    },
    "Mismatch": {
      "title": "Mismatch",
      "type": "object",
      "required": ["path", "message"],
      "properties": {
        "path": { "type": "string" },
        "message": { "type": "string" },
        "action": {
          "type": "string",
          "description": "The action whose node produced the error, when one did."
        }
      }
    }
  }
}
